[{"uuid": "2419713087701cddf0cd59df4df83c07f136c355", "url": "http://omgili.com/ri/jHIAmI4hxg_ZZEJxw_HVLIVMnaJd1bQMlnaaNDSg36OZw3qbPZovHAlzP4mhxVsLZ0heI7RV53uKAo4_1ugui17nct4naQOyxXxHY74s8fBRDtMuxDu6RKDwgwGs1gRuDSLXJ7nUbHC5t9CYkzm_LkLsPMXdpwZuiNtZm._iSA9P0TWHQT5YkHa8c6SjxEiwWgImNnHK8WJwqiQacMk8Yw--", "title": "Evercore to Announce First Quarter 2017 Financial Results and Host Conference Call on April 26,", "author": "Evercore", "rating": null, "published": "2017-04-18T23:23:15.000+03:00", "highlightText": "", "entities": {"organizations": [{"name": "evercore", "sentiment": "negative"}, {"name": "abernathy macgregor group", "sentiment": "none"}], "locations": [{"name": "new york", "sentiment": "none"}, {"name": "south america", "sentiment": "none"}, {"name": "asia", "sentiment": "none"}, {"name": "europe", "sentiment": "none"}, {"name": "north america", "sentiment": "none"}], "persons": [{"name": "john weinberg", "sentiment": "none"}, {"name": "roger c. altman", "sentiment": "none"}, {"name": "ralph l. schlosstein", "sentiment": "none"}, {"name": "robert b. walsh", "sentiment": "none"}, {"name": "dana gorman", "sentiment": "none"}]}, "highlightTitle": "", "thread": {"uuid": "2419713087701cddf0cd59df4df83c07f136c355", "url": "http://omgili.com/ri/jHIAmI4hxg_ZZEJxw_HVLIVMnaJd1bQMlnaaNDSg36OZw3qbPZovHAlzP4mhxVsLZ0heI7RV53uKAo4_1ugui17nct4naQOyxXxHY74s8fBRDtMuxDu6RKDwgwGs1gRuDSLXJ7nUbHC5t9CYkzm_LkLsPMXdpwZuiNtZm._iSA9P0TWHQT5YkHa8c6SjxEiwWgImNnHK8WJwqiQacMk8Yw--", "site_full": "www.prnewswire.com", "title": "Evercore to Announce First Quarter 2017 Financial Results and Host Conference Call on April 26,", "site_section": "http://rss.prnewswire.com/industry/fin/", "domain_rank": 3190, "published": "2017-04-18T23:23:15.000+03:00", "title_full": "Evercore to Announce First Quarter 2017 Financial Results and Host Conference Call on April 26,", "participants_count": 1, "replies_count": 0, "spam_score": 0.0, "section_title": "PR Newswire: Banking & Financial Services", "site_type": "news", "social": {"vk": {"shares": 0}, "gplus": {"shares": 0}, "pinterest": {"shares": 0}, "stumbledupon": {"shares": 0}, "facebook": {"shares": 0, "likes": 0, "comments": 0}, "linkedin": {"shares": 0}}, "site_categories": [], "country": "US", "performance_score": 0, "main_image": "https://mma.prnewswire.com/media/320642/evercore_wealth_management_llclogo.jpg?p=facebook", "site": "prnewswire.com"}, "external_links": [], "language": "english", "text": "NEW YORK - Evercore (NYSE: EVR ) will release its first quarter 2017 financial results on Wednesday, April 26 , 2017. Evercore will host a related conference call beginning at 8:00 a.m. Eastern Time that same day, accessible via telephone and the internet.\nRalph L. Schlosstein , President and Chief Executive Officer, John Weinberg , Executive Chairman, Roger C. Altman , Founder and Senior Chairman, and Robert B. Walsh , Chief Financial Officer, will review the Firm's first quarter 2017 financial results. Following the review, there will be a question and answer session. This conference call is expected to last approximately one hour.\nInvestors and analysts may participate in the live conference call by dialing (877) 359-9508 (toll-free domestic) or (224) 357-2393 (international); passcode: 9160841. Please register at least 10 minutes before the conference call begins. A replay of the call will be available for one week via telephone starting approximately one hour after the call ends. The replay can be accessed at (855) 859-2056 (toll-free domestic) or (404) 537-3406 (international); passcode: 9160841. A live audio webcast of the conference call will be available on the Investor Relations section of Evercore's website at www.evercore.com . The webcast will be archived on Evercore's website for 30 days after the call.\nAbout Evercore\nEstablished in 1995, Evercore is a leading global independent investment banking advisory firm. Evercore advises a diverse set of investment banking clients on a wide range of transactions and issues and provides institutional investors with high quality equity research, sales and trading execution that is free of the conflicts created by proprietary activities. The Firm also offers investment management services to high net worth and institutional investors. With 28 offices and affiliate offices in North America , Europe , South America and Asia , Evercore has the scale and strength to serve clients globally through a focused and tailored approach designed to meet their unique needs. More information about Evercore can be found on the Company's website at www.evercore.com .\nInvestor Contact:\nRobert B. Walsh\nChief Financial Officer, Evercore\n+1.212.857.3100\nMedia Contact:\nDana Gorman\nThe Abernathy MacGregor Group, for Evercore\n+1.212.371.5999\nTo view the original version on PR Newswire, visit: http://www.prnewswire.com/news-releases/evercore-to-announce-first-quarter-2017-financial-results-and-host-conference-call-on-april-26-2017-300441168.html\nSOURCE Evercore\nRelated Links\nhttp://www.evercore.com", "ord_in_thread": 0, "crawled": "2017-04-18T23:23:15.000+03:00"}]