[{"thread": {"domain_rank": null, "replies_count": 0, "url": "http://omgili.com/ri/uBQNNiLKiWarOBJfFzTgVofOoNADvX6AcQWiujlO0bPeqWarLjrh49couiMY6ed3RH0RF_TuuyPd7KeLSM.YoS74brLJGKNRk9Q3qrE6HnTgdGK55ojbZmAtS9E3WIKcfc8ROfYqHvEyVRlLXRKZbXDRa1Wats.umxVsEiJwWpg-", "title": "Cristiano Cabutti Named Marriott's Area Director of Sales & Distribution, Southern Europe", "site_type": "news", "social": {"pinterest": {"shares": 0}, "stumbledupon": {"shares": 0}, "gplus": {"shares": 0}, "vk": {"shares": 0}, "linkedin": {"shares": 0}, "facebook": {"comments": 0, "shares": 0, "likes": 0}}, "site_section": "http://hotelexecutive.com/rss.xml", "spam_score": 0.0, "section_title": "HotelExecutive.com - Your view from the top", "site": "hotelexecutive.com", "site_full": "hotelexecutive.com", "performance_score": 0, "uuid": "265de4dc9cc209d3f2376a60b18ba6b598eb364e", "published": "2017-04-17T08:00:00.000+03:00", "site_categories": [], "country": "US", "title_full": "Cristiano Cabutti Named Marriott's Area Director of Sales & Distribution, Southern Europe", "participants_count": 0, "main_image": ""}, "url": "http://omgili.com/ri/uBQNNiLKiWarOBJfFzTgVofOoNADvX6AcQWiujlO0bPeqWarLjrh49couiMY6ed3RH0RF_TuuyPd7KeLSM.YoS74brLJGKNRk9Q3qrE6HnTgdGK55ojbZmAtS9E3WIKcfc8ROfYqHvEyVRlLXRKZbXDRa1Wats.umxVsEiJwWpg-", "title": "Cristiano Cabutti Named Marriott's Area Director of Sales & Distribution, Southern Europe", "highlightTitle": "", "external_links": [], "crawled": "2017-04-17T11:26:19.000+03:00", "language": "english", "entities": {"locations": [{"name": "usa", "sentiment": "none"}, {"name": "cyprus", "sentiment": "none"}, {"name": "sardinia", "sentiment": "none"}, {"name": "england", "sentiment": "none"}, {"name": "forte village resort", "sentiment": "none"}, {"name": "ny", "sentiment": "none"}, {"name": "portugal", "sentiment": "none"}, {"name": "spain", "sentiment": "none"}, {"name": "malta", "sentiment": "none"}, {"name": "greece", "sentiment": "none"}, {"name": "san domenico hotels", "sentiment": "none"}, {"name": "europe  new york", "sentiment": "none"}, {"name": "southern europe", "sentiment": "none"}, {"name": "italy", "sentiment": "none"}, {"name": "salsomaggiore terme", "sentiment": "none"}, {"name": "bethesda", "sentiment": "none"}, {"name": "jordan", "sentiment": "none"}, {"name": "maryland", "sentiment": "none"}], "persons": [{"name": "cristiano cabutti", "sentiment": "none"}, {"name": "cristiano", "sentiment": "none"}], "organizations": [{"name": "sales & distribution", "sentiment": "none"}, {"name": "southern europe appointments & promotions cristiano cabutti named marriott", "sentiment": "none"}, {"name": "marriott", "sentiment": "none"}, {"name": "group director of sales & marketing", "sentiment": "none"}, {"name": "marriott international", "sentiment": "none"}, {"name": "jw marriott venice resort & spa", "sentiment": "none"}, {"name": "hotelexecutive.com", "sentiment": "none"}, {"name": "jw marriott", "sentiment": "none"}, {"name": "g. magnaghi school", "sentiment": "none"}, {"name": "marriott  jw marriott", "sentiment": "none"}, {"name": "marriott international, inc.", "sentiment": "none"}, {"name": "marriott venice resort & spa", "sentiment": "none"}]}, "rating": null, "highlightText": "", "ord_in_thread": 0, "uuid": "265de4dc9cc209d3f2376a60b18ba6b598eb364e", "published": "2017-04-17T08:00:00.000+03:00", "author": "", "text": "Appointments & Promotions Cristiano Cabutti Named Marriott's Area Director of Sales & Distribution, Southern Europe \nNEW YORK, NY. April 17, 2017 - JW Marriott Venice Resort & Spa has announced that Cristiano Cabutti has been named Marriott's Area Director Sales & Marketing for Southern Europe. Cristiano has been the Director of Sales & Marketing at JW Marriott Venice Resort & Spa since 2013, overseeing the opening of the brand's first Italian property. \nIn his new role, Cristiano will oversee managed core brand hotels for Marriott and all luxury brand hotels, including properties managed by Marriott and franchised, in Spain, Italy, Portugal, Greece, Cyprus and Malta. Cristiano started his career with Marriott in 2013 as part of the JW Marriott Venice Resort & Spa's opening team and has successfully positioned the award-winning property as a one-of-a-kind luxury resort in the market. Prior to joining Marriott, Cristiano was the Group Director of Sales & Marketing for San Domenico Hotels and golf resorts in Italy and England, and also held the position of Director of Sales & Marketing at the Forte Village Resort (7 hotels) in Sardinia. \nCristiano has a degree in tourism with a major in hotel activities from G. Magnaghi School in Salsomaggiore Terme, Italy. He speaks Italian, French and English. \nAbout JW Marriott \nJW Marriott is part of Marriott International's luxury portfolio and consists of beautiful properties in gateway cities and distinctive resort locations around the world. These elegant hotels cater to today's sophisticated, self-assured travelers, offering them the quiet luxury they seek in a warmly authentic, relaxed atmosphere lacking in pretense. JW Marriott properties artfully provide highly crafted, anticipatory experiences that are reflective of their locale so that their guests have the time to focus on what is most important to them. Currently, there are 70 JW Marriott hotels in 26 countries; by 2020 the portfolio is expected to encompass more than 100 properties in over 30 countries. Visit us online. Marriott International, Inc. (NASDAQ: MAR) is a leading global lodging company based in Bethesda, Maryland, USA, with more than 4,100 properties in 79 countries and territories and reported revenues of nearly $14 billion in fiscal year 2014. The company operates and franchises hotels and licenses vacation ownership resorts under 18 brands. For more information or reservations, please visit our website at www.marriott.com, and for the latest company news, visit www.marriottnewscenter.com. \nFor more information, media enquiries on JW Marriott Venice Resort & Spa please contact: Jordan Dick In The May Online Hotel Business Review s and how they and the environment are benefiting from them. \u00a9 1996-2017. All content on HotelExecutive.com is exclusively copyright to HotelExecutive.com and cannot be republished without prior written consent by HotelExecutive.com. & Use"}]