[{"uuid": "5566c1ca9954a8527e123cffebd50d15ce459ec7", "url": "http://omgili.com/ri/jHIAmI4hxg_ZZEJxw_HVLIVMnaJd1bQMlnaaNDSg36OZw3qbPZovHPxlcCIBSQOMakbaOT_eLv0FCpK7BgPsQ_odherooqxLQ5ZLppKxAqZZaNdP4U7Mq9oWal5I8idze2y23Z23.Qpcw6n3FiWGkk2HtqdbacbF9naoRymur3wfYi4fxW..GrDJJLVr8ikzb3lkHzRs.U0-", "title": "Central Pacific Financial Corp. Conference Call To Discuss First Quarter 2017 Financial Results", "author": "Central Pacific Financial Corp.", "rating": null, "published": "2017-04-18T23:23:13.000+03:00", "highlightText": "", "entities": {"organizations": [{"name": "central pacific financial corp", "sentiment": "negative"}, {"name": "cpf", "sentiment": "negative"}, {"name": "central pacific financial corp.", "sentiment": "negative"}, {"name": "central pacific ba", "sentiment": "negative"}, {"name": "new york stock exchange", "sentiment": "none"}, {"name": "about central pacific financial corp", "sentiment": "none"}, {"name": "central pacific bank", "sentiment": "none"}], "locations": [{"name": "honolulu", "sentiment": "none"}, {"name": "hawaii time", "sentiment": "none"}, {"name": "hawaii", "sentiment": "none"}], "persons": []}, "highlightTitle": "", "thread": {"uuid": "5566c1ca9954a8527e123cffebd50d15ce459ec7", "url": "http://omgili.com/ri/jHIAmI4hxg_ZZEJxw_HVLIVMnaJd1bQMlnaaNDSg36OZw3qbPZovHPxlcCIBSQOMakbaOT_eLv0FCpK7BgPsQ_odherooqxLQ5ZLppKxAqZZaNdP4U7Mq9oWal5I8idze2y23Z23.Qpcw6n3FiWGkk2HtqdbacbF9naoRymur3wfYi4fxW..GrDJJLVr8ikzb3lkHzRs.U0-", "site_full": "www.prnewswire.com", "title": "Central Pacific Financial Corp. Conference Call To Discuss First Quarter 2017 Financial Results", "site_section": "http://rss.prnewswire.com/industry/fin/", "domain_rank": 3190, "published": "2017-04-18T23:23:13.000+03:00", "title_full": "Central Pacific Financial Corp. Conference Call To Discuss First Quarter 2017 Financial Results", "participants_count": 1, "replies_count": 0, "spam_score": 0.0, "section_title": "PR Newswire: Banking & Financial Services", "site_type": "news", "social": {"vk": {"shares": 0}, "gplus": {"shares": 0}, "pinterest": {"shares": 0}, "stumbledupon": {"shares": 0}, "facebook": {"shares": 0, "likes": 0, "comments": 0}, "linkedin": {"shares": 0}}, "site_categories": [], "country": "US", "performance_score": 0, "main_image": "https://mma.prnewswire.com/media/254362/central_pacific_financial_corp.jpg?p=facebook", "site": "prnewswire.com"}, "external_links": [], "language": "english", "text": "Central Pacific Financial Corp. Conference Call To Discuss First Quarter 2017 Financial Results News provided by 18 Apr, 2017, 16:15   \nHONOLULU , April 18,   Central Pacific Financial Corp. (NYSE: CPF), parent company of Central Pacific Bank, will release its first quarter 2017 earnings on April 26, 2017 , before the open of the New York Stock Exchange. Management will review the first quarter results by conference call and live audio webcast beginning at 1:00 p.m. Eastern Time ( 7:00 a.m. Hawaii Time) on April 26, 2017 . \nInterested parties may listen to the conference by calling 1-877-505-7644, or by listening to the webcast on the company's investor relations website at http://ir.centralpacificbank.com . A replay of the call will be available through May 26, 2017 by dialing 1-877-344-7529 (passcode: 10105178) and on the company's website. \nAbout Central Pacific Financial Corp. \nCentral Pacific Financial Corp. is a Hawaii -based bank holding company with $5.4 billion in assets. Central Pacific Bank, its primary subsidiary, operates 35 branches and 103 ATMs in the state of Hawaii as of December 31 , 2016. For additional information, please visit the Company's website at http://www.centralpacificbank.com . \nTo view the original version on PR Newswire, visit: http://www.prnewswire.com/news-releases/central-pacific-financial-corp-conference-call-to-discuss-first-quarter-2017-financial-results-300440564.html \nSOURCE Central Pacific Financial Corp. Related Links", "ord_in_thread": 0, "crawled": "2017-04-18T23:23:13.000+03:00"}]