[{"rating": null, "external_links": [], "crawled": "2017-04-16T08:26:29.000+03:00", "author": "", "entities": {"persons": [{"name": "altaf ahmad dar", "sentiment": "none"}, {"name": "altaf", "sentiment": "none"}, {"name": "altaf ahmad", "sentiment": "none"}, {"name": "bashir ahmad dar", "sentiment": "none"}], "locations": [{"name": "srinagar", "sentiment": "none"}, {"name": "new delhi", "sentiment": "none"}, {"name": "kashmir", "sentiment": "none"}, {"name": "pulwama", "sentiment": "none"}, {"name": "rajpora", "sentiment": "none"}, {"name": "jammu", "sentiment": "none"}, {"name": "india", "sentiment": "none"}], "organizations": [{"name": "pdp", "sentiment": "none"}, {"name": "ians", "sentiment": "none"}, {"name": "ians india private limited", "sentiment": "none"}, {"name": "ians group", "sentiment": "none"}, {"name": "peoples democratic party", "sentiment": "none"}, {"name": "facebook", "sentiment": "none"}]}, "text": "PDP worker killed, two injured in J&K \nIANS Srinagar, April 16 (IANS) Militants have killed a ruling Peoples Democratic Party (PDP) worker and injured two others in Pulwama district of Jammu and Kashmir, police said on Sunday. Police said militants barged into the house of Bashir Ahmad Dar, 45, in Rajpora area of Pulwama district late Saturday evening. \"Militants fired indiscriminately after barging into the house of Bashir Ahmad Dar in Rajpora. \"He succumbed to injuries while another person was injured in the incident. \"Militants had earlier fired at another person identified as Altaf Ahmad Dar near the local bus stand. Altaf sustained a bullet injury in his leg,\" police said. Bashir Ahmad Dar and Altaf Ahmad were reportedly workers of the ruling PDP. \u00a9 2017 IANS India Private Limited. All Rights Reserved. The reproduction of the story/photograph in any form will be liable for legal action. For news, views and gossips, follow @IANSLIVE at Twitter . Find us on Facebook too! \nUpdate: 16-April-2017 \nHi ! \nWelcome to www.ianslive.in \nA corporate retail face of IANS Group, www.ianslive.in presents to you a vivid world of news, views, features, gossips, entertainment, business, sports, international, videos/photos and what not. \nOperational 24/7 and currently available in English, the portal brings in a youthful approach in its news coverage, with catchy headlines and impeccable stories that are reliable, accurate and balanced. \nOne of the USPs of the portal is its exhaustive video/lifestyle and photo galleries, that stores all the latest photos and entertainment videos. \nWhat makes ianslive.in different from other news portals is the authenticity of the information on offer. \nWe welcome you to visit ianslive.in to have a feel of various interesting features of the portal and spare few minutes to fill the subscription form. \nBest Regards, Privacy Policy X \nWWW.IANSLIVE.IN DISCLAIMER & TERMS OF USE \nBy accessing ianslive.in, you have read, understood and agree to be legally bound by the terms of the following disclaimer and user agreement: \nThis Site is owned and operated by IANS Group and contains material which is derived in whole or in part from material supplied by the Company, various news agencies and other sources, and is protected by international copyright and trademark laws. Except where specifically authorised, the reader may not modify, copy, reproduce, republish, upload, post, transmit or distribute in any way any material from this site including code and software. \nThe Company shall have the right at any time to change or modify the terms and conditions applicable to user's use of the ianslive.in \nTerms of Use: \nBy visiting our site you are agreeing to be bound by the following terms and conditions. We may change these terms and conditions at any time. Your continued use of ianslive.in means that you accept any new or modified terms and conditions that we come up with. \nThe term 'ianslive.in' is used through this entire Terms of Use document to refer to the website, its owners and the employees and associates of the owner \nLICENSE \nianslive.in hereby grants you a limited, non-exclusive, non-assignable and non-transferable license to access ianslive.in provided and expressly conditioned upon your agreement that all such access and use shall be governed by all of the terms and conditions set forth in this USER AGREEMENT. \nCOPYRIGHT & NO RETRANSMISSION OF INFORMATION: \nianslive.in as well as the design and information contained in this site is the valuable, exclusive property of IANS Group, and nothing in this Agreement shall be construed as transferring or assigning any such ownership rights to you or any other person or entity. \nYou may not resell, redistribute, broadcast or transfer information, software and applications or use the information, software and applications provided by ianslive.in in a searchable, machine-readable database unless separately and specifically authorized in writing by ianslive.in prior to such use. \nYou may not rent, lease, sublicense, distribute, transfer, copy, reproduce, publicly display, publish, adapt, store or time-share ianslive.in, any part thereof, or any of the software, application or information received or accessed there from to or through any other person or entity unless separately and specifically authorized in writing by ianslive.in prior to such use. \nIn addition, you may not remove, alter or obscure any copyright, legal or proprietary notices in or on any portions of ianslive.in without prior written authorization. Except as set forth herein, any other use of the information, software or application contained in this site requires the prior written consent of ianslive.in and may require a separate fee. \nDELAYS IN SERVICES: \nNeither ianslive.in (including its and their directors, employees, affiliates, agents, representatives or subcontractors) shall be liable for any loss or liability resulting, directly or indirectly, from delays or interruptions due to electronic or mechanical equipment failures, telephone interconnect problems, defects, weather, strikes, walkouts, fire, acts of God, riots, armed conflicts, acts of war, or other like causes. ianslive.in shall have no responsibility to provide you access to ianslive.in while interruption of ianslive.in is due to any such cause shall continue. \nLIABILITY DISCLAIMER: \nYOU EXPRESSLY AGREE THAT USE OF THE WEBSITE IS AT YOUR SOLE RISK. \nTHE CONTENTS, INFORMATION, SOFTWARE, PRODUCTS, FEATURES AND SERVICES PUBLISHED ON THIS WEB SITE MAY INCLUDE INACCURACIES OR TYPOGRAPHICAL ERRORS. CHANGES ARE PERIODICALLY ADDED TO THE CONTENTS HEREIN. IANSLIVE.IN AND/OR ITS RESPECTIVE SUPPLIERS MAY MAKE IMPROVEMENTS AND/OR CHANGES IN THIS WEB SITE AT ANY TIME. THIS WEB SITE MAY BE TEMPORARILY UNAVAILABLE FROM TIME TO TIME DUE TO REQUIRED MAINTENANCE, TELECOMMUNICATIONS INTERRUPTIONS, OR OTHER DISRUPTIONS. IANSLIVE.IN (AND ITS OWNERS, SUPPLIERS, CONSULTANTS, ADVERTISERS, AFFILIATES, PARTNERS, EMPLOYEES OR ANY OTHER ASSOCIATED ENTITIES, ALL COLLECTIVELY REFERRED TO AS ASSOCIATED ENTITIES HEREAFTER) SHALL NOT BE LIABLE TO USER OR MEMBER OR ANY THIRD PARTY SHOULD IANSLIVE.IN EXERCISE ITS RIGHT TO MODIFY OR DISCONTINUE ANY OR ALL OF THE CONTENTS, INFORMATION, SOFTWARE, PRODUCTS, FEATURES AND SERVICES PUBLISHED ON THIS WEBSITE. \nIN NO EVENT SHALL IANSLIVE.IN AND/OR ITS ASSOCIATED ENTITIES BE LIABLE FOR ANY DIRECT, INDIRECT, PUNITIVE, INCIDENTAL, SPECIAL OR CONSEQUENTIAL DAMAGES ARISING OUT OF OR IN ANY WAY CONNECTED WITH THE USE OF THIS WEB SITE OR WITH THE DELAY OR INABILITY TO USE THIS WEBSITE, OR FOR ANY CONTENTS, INFORMATION, SOFTWARE, PRODUCTS, FEATURES AND SERVICES OBTAINED THROUGH THIS WEB SITE, OR OTHERWISE ARISING OUT OF THE USE OF THIS WEB SITE, WHETHER BASED ON CONTRACT, TORT, STRICT LIABILITY OR OTHERWISE, EVEN IF IANSLIVE.IN OR ANY OF ITS ASSOCIATED ENTITIES HAS BEEN ADVISED OF THE POSSIBILITY OF DAMAGES. \nLINKS TO THIRD PARTY SITES \nThe links in this site will allow you to leave ianslive.in. The linked sites are not under the control of ianslive.in. ianslive.in has not reviewed, nor approved these sites and is not responsible for the contents or omissions of any linked site or any links contained in a linked site. The inclusion of any linked site does not imply endorsement by ianslive.in of the site. Third party links to ianslive.in shall be governed by a separate agreement. \nINDEMNIFICATION: \nYOU SHALL INDEMNIFY, DEFEND AND HOLD HARMLESS IANSLIVE.IN (INCLUDING ITS AND THEIR OFFICERS, DIRECTORS, EMPLOYEES, AFFILIATES, GROUP COMPANIES, AGENTS, REPRESENTATIVES OR SUBCONTRACTORS) FROM ANY AND ALL CLAIMS AND LOSSES IMPOSED ON, INCURRED BY OR ASSERTED AS A RESULT OF OR RELATED TO: (a) your access and use of ianslive.in (b) any non-compliance by user with the terms and conditions hereof; or (c) any third party actions related to users receipt and use of the information, whether authorized or unauthorized. Any clause declared invalid shall be deemed severable and not affect the validity or enforceability of the remainder. These terms may only be amended in a writing signed by ianslive.in. \nJURISDICTION: \nThe terms of this agreement are exclusively based on and subject to Indian law. You hereby consent to the exclusive jurisdiction and venue of courts in New Delhi, India in all disputes arising out of or relating to the use of this website. Use of this website is unauthorized in any jurisdiction that does not give effect to all provisions of these terms and conditions, including without limitation this paragraph. \nIf you really prefer to send email using your own email program, write to: Advertise with us X", "url": "http://omgili.com/ri/jHIAmI4hxg89u7Lch_RyNga.qwGmRVkJXZwMuEHByOBcN896gdZ3t4ITw6.CtSxHdkScHEGfYH8Ig.Yc9_cWyr9yntbvKPMZCnjmKQ7BMBQQA5eFBvLP4oaToNg7eDUPq9mo4L6qupU-", "highlightText": "", "highlightTitle": "", "published": "2017-04-16T08:26:29.000+03:00", "language": "english", "title": "PDP worker killed, two injured in J", "thread": {"title_full": "PDP worker killed, two injured in J", "site_full": "www.ianslive.in", "site": "ianslive.in", "site_section": "http://www.newslookup.com/rss/newslookup-usnp.rss", "performance_score": 0, "social": {"gplus": {"shares": 0}, "pinterest": {"shares": 0}, "facebook": {"likes": 0, "shares": 0, "comments": 0}, "linkedin": {"shares": 0}, "vk": {"shares": 0}, "stumbledupon": {"shares": 0}}, "participants_count": 0, "site_type": "news", "spam_score": 0.0, "domain_rank": null, "replies_count": 0, "site_categories": [], "country": "US", "section_title": "US Newspapers: National", "url": "http://omgili.com/ri/jHIAmI4hxg89u7Lch_RyNga.qwGmRVkJXZwMuEHByOBcN896gdZ3t4ITw6.CtSxHdkScHEGfYH8Ig.Yc9_cWyr9yntbvKPMZCnjmKQ7BMBQQA5eFBvLP4oaToNg7eDUPq9mo4L6qupU-", "published": "2017-04-16T08:26:29.000+03:00", "title": "PDP worker killed, two injured in J", "uuid": "b436ff5cd52ed2c9cd0fc61b4f6830baf5c65717", "main_image": "http://ianslive.in/upload/2017/April/16/Shot dead 220170416094428_l.jpg"}, "uuid": "b436ff5cd52ed2c9cd0fc61b4f6830baf5c65717", "ord_in_thread": 0}]