[{"entities": {"organizations": [{"name": "complete works", "sentiment": "none"}, {"name": "facebook", "sentiment": "none"}], "locations": [{"name": "tumblr", "sentiment": "none"}], "persons": [{"name": "nicolas cage", "sentiment": "none"}, {"name": "michae", "sentiment": "none"}, {"name": "mike smith", "sentiment": "none"}, {"name": "mike decriscio", "sentiment": "none"}, {"name": "jacob marley", "sentiment": "none"}, {"name": "rhys ifans", "sentiment": "none"}, {"name": "kate winslet", "sentiment": "none"}, {"name": "smith", "sentiment": "none"}, {"name": "simon callow", "sentiment": "none"}, {"name": "piet kroon", "sentiment": "none"}, {"name": "mike", "sentiment": "none"}, {"name": "jane horrocks", "sentiment": "none"}, {"name": "jimmy t. murakami", "sentiment": "none"}, {"name": "michael gambon", "sentiment": "none"}, {"name": "robert llewellyn", "sentiment": "none"}]}, "uuid": "b78440d6269cb5b2e6e6e905399dbfeed2293284", "highlightText": "", "title": "The Complete Works Ep. 37: Nicolas Cage \u2013 CHRISTMAS CAROL: THE MOVIE (2001)", "thread": {"site": "film-book.com", "country": "US", "participants_count": 1, "site_full": "film-book.com", "section_title": "FilmBook", "uuid": "b78440d6269cb5b2e6e6e905399dbfeed2293284", "site_section": "http://feeds.feedburner.com/film-book/dAVg", "domain_rank": null, "main_image": "http://cdn.film-book.com/wp-content/uploads/2017/04/nicolas-cage-christmas-carol-01-600x350.jpg", "performance_score": 0, "published": "2017-04-16T23:36:18.000+03:00", "url": "http://omgili.com/ri/.0rSU5LtMgzhqaKLFSMw6Kmz9.C8B5m3dFGwdQMzPF.GpYxDZl2jM7qSfKO.6lE8rwDJFA7yPbGoq021ZrwCnM2jrNx6HXIsuRWFZlIg64M5GX8BIHDMvg--", "title_full": "The Complete Works Ep. 37: Nicolas Cage \u2013 CHRISTMAS CAROL: THE MOVIE (2001)", "title": "The Complete Works Ep. 37: Nicolas Cage \u2013 CHRISTMAS CAROL: THE MOVIE (2001)", "site_type": "blogs", "social": {"stumbledupon": {"shares": 0}, "facebook": {"likes": 0, "shares": 0, "comments": 0}, "pinterest": {"shares": 0}, "gplus": {"shares": 0}, "vk": {"shares": 0}, "linkedin": {"shares": 0}}, "spam_score": 0.0, "site_categories": [], "replies_count": 0}, "language": "english", "published": "2017-04-16T23:36:18.000+03:00", "url": "http://omgili.com/ri/.0rSU5LtMgzhqaKLFSMw6Kmz9.C8B5m3dFGwdQMzPF.GpYxDZl2jM7qSfKO.6lE8rwDJFA7yPbGoq021ZrwCnM2jrNx6HXIsuRWFZlIg64M5GX8BIHDMvg--", "ord_in_thread": 0, "crawled": "2017-04-16T23:36:18.000+03:00", "rating": null, "external_links": [], "highlightTitle": "", "author": "Michael Smith", "text": "The Complete Works Ep. 37: Nicolas Cage \u2013 CHRISTMAS CAROL: THE MOVIE (2001) April 16, 2017 by Michael Smith The Complete Works is an in-depth, introspective, and, quite frankly, insane idea \u2013 FilmBook contributor Mike Smith and his co-host Mike DeCriscio are going to take a look at every film in the filmography of Nicolas Cage , one crazy screaming scene at a time. This week, Mike and Mike discuss Nicolas Cage\u2019s role in 2001\u2019s Christmas Carol: The Movie . Nicolas Cage plays Jacob Marley, alongside Simon Callow , Kate Winslet , Jane Horrocks , Michael Gambon , and Rhys Ifans , among others. Christmas Carol: The Movie was written by Robert Llewellyn and Piet Kroon and directed by Jimmy T. Murakami . If you\u2019d like to advertise with us or sponsor us, please email advertise[AT]film-book[DOT]com . You can donate and support this Podcast by clicking this Donate link to contribute once or this Donate link to contribute every month. Thanks to all our donors. Any and all feedback, compliments, topic discussions, and even hate mail can be sent directly to podcast[AT]film-book[DOT]com Please list the podcast you are emailing about in the title of your email (we produce a gaggle of different ones per month). We would LOVE to hear from you! Thank you for listening to the show. Listen to The Complete Works review of Christmas Carol: The Movie below and leave your thoughts on both the film and the review in the comments section. For more Christmas Carol: The Movie photos, videos, and information, visit our Christmas Carol: The Movie page, subscribe to us by Email , \u201cfollow\u201d us on Twitter , Tumblr , or \u201clike\u201d us on Facebook . The Complete Works Ep. 37"}]